2;12;0;0;Цветная Тыква Ву Лу;ЦВЕТНАЯ ТЫКВА ВУ ЛУ;Cvetnaya-Tykva-Vu-Lu;tykva.jpg;none;none;none;45;45;90;L-5578;не указано;<null>;не указано;<null>;ТЫКВЫ ВУ ЛУ;;;Цветная Тыква Ву Лу;Цветная Тыква Ву Лу Фэн-Шуй товары статуэтки амулеты символы талисманы купить оптом или в розницу недорого;780;680;3;0;85;0;f;f;f;t;<null>;<null>;<null>;<null>;2018-07-26 22:32:28.177801;2018-07-26 22:32:28.177801
3;12;0;0;Денежное Дерево с 108 Драгоценными Лаймами;ДЕНЕЖНОЕ ДЕРЕВО С 108 ДРАГОЦЕННЫМИ ЛАЙМАМИ;Denezhnoe-Derevo-s-108-Dragocennymi-Lajmami;CESaFCO5gNA.jpg;none;none;none;0;0;0;M-115;не указано;<null>;не указано;<null>;ДЕНЕЖНЫЕ ДЕРЕВЬЯ;"<p>108 Драгоценных камней - лаймов представляют собой бесконечное богатство в течение 2018 года и активируют звезду #8. Данное дерево приносит богатство, успехи в денежных делах и повышает Вашу общую и денежную удачу!</p><p><b style=""font-size: 1rem;"">? Поместите это Драгоценное Дерево в Юго-Восточном секторе Вашего дома!</b><br></p>";;Денежное Дерево с 108 Драгоценными Лаймами;Денежное Дерево с 108 Драгоценными Лаймами коллекция Лиллиан Ту 2018 года Фэн-Шуй товары купить оптом или в розницу недорого;4058;3798;2;0;47;0;f;f;f;f;<null>;<null>;<null>;<null>;2018-07-26 22:34:15.458856;2018-07-26 22:34:15.458856
4;2;0;0;"Подвеска ""Три Круга"" с Мантрами от Несчастий";"ПОДВЕСКА ""ТРИ КРУГА"" С МАНТРАМИ ОТ НЕСЧАСТИЙ";Podveska-Tri-Kruga-s-Mantrami-ot-Neschastij;j5Po-8OhpRA.jpg;none;none;none;0;0;0;000221;не указано;<null>;не указано;<null>;АМУЛЕТЫ - ПОДВЕСКИ;"<p>Данная подвеска олицетворяет окончательный союз мужских и женских энергий. На кольце из Розового золота выбиты Мантры Богини Тары, а на внешнем Золотом кольце - мантра Гуру Ринпоче.&nbsp;<span style=""font-size: 1rem;"">Это подвеска - мощный амулет с Защитой от стихийных бедствий, несчастных случаев, вреда от духов и врагов.</span></p><p><b style=""font-size: 1rem;"">? Носите данную подвеску ежедневно для постоянной защиты!</b></p>";;"Подвеска ""Три Круга"" с Мантрами от Несчастий";"Подвеска ""Три Круга"" с Мантрами от Несчастий коллекция Лиллиан Ту 2018 года Фэн-Шуй товары купить оптом или в розницу недорого";458;398;3;0;60;0;f;f;f;f;<null>;<null>;<null>;<null>;2018-07-30 00:59:59.271352;2018-07-30 00:59:59.271352
5;2;0;0;Кулон с Аметистом для Укрепления Брака и Защиты от измены;КУЛОН С АМЕТИСТОМ ДЛЯ УКРЕПЛЕНИЯ БРАКА И ЗАЩИТЫ ОТ ИЗМЕНЫ;Kulon-s-Ametistom-dlya-Ukrepleniya-Braka-i-Zashhity-ot-izmeny;xpUZUP2R9Sw.jpg;none;none;none;0;0;0;000216;не указано;<null>;не указано;<null>;АМУЛЕТЫ - КУЛОНЫ;"<p>Аметист в данному Кулоне обеспечивает эффективную защиту для любой Пары или союза! Этот сильный талисман защищает от тех, кто хочет разделить Ваши дружеские или партнерские отношения с кем-либо.&nbsp;<span style=""font-size: 1rem;"">Так же данный Кулон с Аметистом защищает Ваш бизнес от негативного вмешательства с третьей стороны.</span></p><p><span style=""font-size: 1rem;""><b>? Носите данный Кулон при себе и наслаждайтесь Прекрасными отношениями!</b></span><br></p>";;Кулон с Аметистом для Укрепления Брака и Защиты от измены;Кулон с Аметистом для Укрепления Брака и Защиты от измены коллекция Лиллиан Ту 2018 года Фэн-Шуй товары купить оптом или в розницу недорого;398;368;3;0;40;0;f;f;f;f;<null>;<null>;<null>;<null>;2018-07-30 01:01:36.052587;2018-07-30 01:01:36.052587
6;12;0;0;"Шкатулка ""Королевская Корона"", украшенная Драгоценными камнями";"ШКАТУЛКА ""КОРОЛЕВСКАЯ КОРОНА"", УКРАШЕННАЯ ДРАГОЦЕННЫМИ КАМНЯМИ";"Shkatulka-""Korolevskaya-Korona"",-ukrashennaya-Dragocennymi-kamnyami";jW9FKP6n_10.jpg;none;none;none;60;50;60;SH170;не указано;не указано;Металл;Китай;ШКАТУЛКИ ФЭН-ШУЙ;"<p>Украшенная Драгоценными Камнями Корона поможет Вам привлечь к себе энергию и удачу Королей, Властителей и прочих Влиятельных персон! Благодаря Короне - Шкатулке вы активируете в Вашей жизни увеличение власти, высокое положение в обществе, карьерный рост и приток капитала. Насладитесь Королевской удачей!</p><p><b style=""font-size: 1rem;"">? Данную Корону-Шкатулку рекомендуется поместить на Севере вашего дома, лучше всего в гостинной!</b><br></p>";;"Шкатулка ""Королевская Корона"", украшенная Драгоценными камнями";"Шкатулка ""Королевская Корона"", украшенная Драгоценными камнями коллекция Лиллиан Ту 2018 года Фэн-Шуй товары купить оптом или в розницу недорого";738;690;2;0;27;0;f;f;f;t;<null>;<null>;<null>;<null>;2018-07-30 01:03:21.974434;2018-07-30 01:03:21.974434
8;6;0;0;Пагода с Молитвенным Барабаном Калачкара на Солнечной батарее;ПАГОДА С МОЛИТВЕННЫМ БАРАБАНОМ КАЛАЧКАРА НА СОЛНЕЧНОЙ БАТАРЕЕ;Pagoda-s-Molitvennym-Barabanom-Kalachkara-na-Solnechnoj-bataree;baraban_5.jpg;none;none;none;0;0;0;DJX-756;не указано;не указано;не указано;Севастопольская;МОЛИТВЕННЫЕ БАРАБАНЫ;"<p>Молитвенный барабан – артефакт, содержащий внутри свёрток бумаги с множественной Мантрой ОМ МАНИ ПАДМЕ ХУМ. Вращение этого Молитвенного Барабана равносильно произношению Мантры вслух, и это способствует умиротворению и очищению.</p><p><span style=""font-size: 1rem;"">Калачакра — это волшебное Колесо времени, способное преобразить всю негативную энергетику в позитивную. Если вы чувствуете напряжение вокруг, сильно устаете или раздражаетесь — пригласите к себе Калачакру. Колесо времени будет постоянно вращаться благодаря солнечной батарее, удаляя все препятствия на вашем пути!</span><br></p><p><span style=""font-size: 1rem;""><b>? Поместите эту Пагоду с Молитвенным Барабаном Калачакру на Юго-Востоке Вашего дома или офиса, лучше всего на Вашем рабочем столе для уменьшения трудностей в вашей работе и увеличения денежного потока!</b></span><br></p>";;Пагода с Молитвенным Барабаном Калачкара на Солнечной батарее;Пагода с Молитвенным Барабаном Калачкара на Солнечной батарее Фэн-Шуй товары купить оптом или в розницу недорого;459;399;3;0;45;0;f;f;f;t;<null>;<null>;<null>;<null>;2018-07-30 01:09:01.474558;2018-07-30 01:09:01.474558
9;12;1;0;"Пагода Пяти Элементов ""Луна и Солнце""";"ПАГОДА ПЯТИ ЭЛЕМЕНТОВ ""ЛУНА И СОЛНЦЕ""";"Pagoda-Pyati-Jelementov-""Luna-i-Solnce""";W-W7ZHgpjuc.jpg;none;none;none;0;0;0;M2017-02;не указано;не указано;не указано;Китай;ПАГОДЫ;"<p>Эта красивейшая Пагода Пяти Элементов предназначена для подавления Пятой Желтой Звезды в течение всего 2018 года. Пятая Желтая Звезда в 2018 году может вызвать серьезные ненастья, неудачи и различную опасность.&nbsp;</p><p><span style=""font-size: 1rem;"">Солнце и Луна помогут Вам активировать Лунные и Солнечные потоки, а слот Хума рассеет любые препятствия и опасности! Основа в виде Лотуса превращает негативную энергию в положительную. Поместите это мощное лекарство в северное расположение дома в 2018 году!</span><br></p><p><span style=""font-size: 1rem;""><b>? Поместите эту мощную Пагоду на севере Вашего дома в 2018 году!</b></span><br></p>";;"Пагода Пяти Элементов ""Луна и Солнце""";"Пагода Пяти Элементов ""Луна и Солнце"" коллекция Лиллиан Ту2018 года Фэн-Шуй товары купить в Москве недорого";2890;2590;2;0;37;0;f;f;f;t;<null>;<null>;<null>;<null>;2018-07-30 01:18:59.833910;2018-07-30 01:18:59.833910
10;6;0;0;Молитвенный Барабан из Латуни;МОЛИТВЕННЫЙ БАРАБАН ИЗ ЛАТУНИ;Molitvennyj-Baraban-iz-Latuni;GUpQAS7JOy0.jpg;none;none;none;0;0;0;DJX-8191;не указано;не указано;не указано;Севастопольская;МОЛИТВЕННЫЕ БАРАБАНЫ;"<div>Молитвенный Барабан нужно крутить во время чтения всех Мантр, когда вам требуется помощь Высших сил в любом Вашем деле. Одно вращение такого барабана равносильно прочтению Мантры.</div><div>Ппри этом данный&nbsp;<span style=""font-size: 1rem;"">Молитвенный Барабан выполняет функцию А</span><span style=""font-size: 1rem;"">мулета и многократно усиливает силу Мантр, упорядочивая потоки&nbsp;</span><span style=""font-size: 1rem;"">образующейся во время ритуала&nbsp;</span><span style=""font-size: 1rem;"">положительной энергии и очищая пространство вокруг от зарядов энергии отрицательной. Это позволяет молитве как можно быстрее достичь Вселенной, а человеку – получить отклик и помощь Божественного начала.</span></div><div><br></div><div><b><span style=""color: rgb(58, 74, 89); font-size: 1rem;"">?&nbsp;</span>Данный&nbsp;<span style=""font-size: 1rem;"">Молитвенный Барабан можно держать в любом месте Вашего дома, главное - не забывать пользоваться&nbsp;</span><span style=""font-size: 1rem;"">когда понадобится помощь Вселенной -</span><span style=""font-size: 1rem;"">&nbsp;во время прочтения Мантр!</span></b></div>";;Молитвенный Барабан из Латуни;Молитвенный Барабан из Латуни Фэн-Шуй товары и символы купить оптом или в розницу недорого;1670;1490;3;0;42;0;f;f;f;t;<null>;<null>;<null>;<null>;2018-07-30 01:20:05.646426;2018-07-30 01:20:05.646426
11;11;0;0;Обезьянки с Монетой на Подставке;ОБЕЗЬЯНКИ С МОНЕТОЙ НА ПОДСТАВКЕ;Obez'yanki-s-Monetoj-na-Podstavke;obezyanki.jpg;none;none;none;0;0;0;T15738;не указано;не указано;не указано;Севастопольская 200;ОБЕЗЬЯНЫ;;;Обезьянки с Монетой на Подставке;Обезьянки с Монетой на Подставке Фэн-Шуй товары купить оптом или в розницу недорого;148;118;3;0;32;0;f;f;f;t;<null>;<null>;<null>;<null>;2018-07-30 01:21:00.115125;2018-07-30 01:21:00.115125
13;12;0;0;Карп-Дракон на Волне Успеха в Образовании;КАРП-ДРАКОН НА ВОЛНЕ УСПЕХА В ОБРАЗОВАНИИ;Karp-Drakon-na-Volne-Uspeha-v-Obrazovanii;8eu01dI-Gsk.jpg;none;none;none;0;0;0;M-3265;не указано;<null>;не указано;<null>;СТАТУЭТКИ ФЭН-ШУЙ;<p>В Фэн-Шуй культуре Карп-Дракон всегда ассоциируется с большими академическими достижениями и успехами!</p><p>Это идеальный Фэн-Шуй для школьников, студентов и молодых людей, начинающих новую карьеру. Открывает двери для новых возможностей и повышает вашу удачу!<br></p><p><b>? Поместите статуэтку Карпа-Дракона на юге в 2018 году!</b><br></p>;;Карп-Дракон на Волне Успеха в Образовании;Карп-Дракон на Волне Успеха в Образовании;1580;1380;2;0;32;0;f;f;f;f;<null>;<null>;<null>;<null>;2018-08-01 19:02:23.223574;2018-08-01 19:02:23.223574
14;12;1;0;Золотое Молитвенное Колесо с Бриллиантами;ЗОЛОТОЕ МОЛИТВЕННОЕ КОЛЕСО С БРИЛЛИАНТАМИ;Zolotoe-Molitvennoe-Koleso-s-Brilliantami;n_cL9_7LaMs.jpg;none;none;none;0;0;0;M2018-03;не указано;не указано;не указано;Севастопольская;,МОЛИТВЕННЫЕ БАРАБАНЫ;<p>Легко получить благословение, когда у вас есть молитвенное колесо! При повороте Молитвенного Колеса генерируется благословения распевающейся Мантры миллионы раз!</p><p>Данное Молитвенное Колесо заполнено тысячами ОМАНИ Мантр, а так же сердечной Мантрой Авалокитешвары (воплощения всех Будд Сострадания).<br></p><p>Вращайте Молитвенное Колесо, ежедневно получая светлые Лучи и благословение для решения любых Ваших проблем!<br></p><p><b>? Золотое Молитвенное Колесо может быть размещено в любом месте Вашего дома, но всегда в уважительном месте по отношению к Земле!</b><br></p>;;Золотое Молитвенное Колесо с Бриллиантами;Золотое Молитвенное Колесо с Бриллиантами;2780;2580;2;0;42;0;f;f;f;t;<null>;<null>;<null>;<null>;2018-08-01 19:03:46.254819;2018-08-01 19:03:46.254819
15;12;1;0;Золотая Тыква Ву Лу с Гарудой;ЗОЛОТАЯ ТЫКВА ВУ ЛУ С ГАРУДОЙ;Zolotaya-Tykva-Vu-Lu-s-Garudoj;vjw-w0BQWCA.jpg;none;none;none;80;90;160;M-2018;не указано;<null>;Металл;<null>;ТЫКВЫ ВУ ЛУ;"<p>В 2018 году Звезда Сокращающей Энергии #2 летит на Запад, затрагивая младших членов семьи и тех, кто родился в год Петуха; а так же всех тех, у кого спальня расположена на Западе дома.</p><p>Тыква Ву Лу с великолепной Гарудой подавляет всю негативную энергию Звезды #2, а так же негатив от всех остальных годовых ""негативных"" Звезд. Драгоценные камни на данной Тыкве Ву Лу символизируют «Ценности, исполняющие пожелания», которые дает нам Будда Медицины.<br></p><p><b>? Поместите эту Золотую Тыкву Ву Лу с мощным изображением Гаруды на Западе Вашего дома, чтобы подавить весь негатив и не испытывать сокращение энергии!</b><br></p>";;Золотая Тыква Ву Лу с Гарудой;Золотая Тыква Ву Лу с Гарудой;3280;2980;2;10;51;0;t;f;f;t;<null>;<null>;<null>;<null>;2018-08-01 19:06:58.098584;2018-08-01 19:06:58.098584
16;6;0;0;Защитное Зеркало 8 Хум - мощная защита с восьми сторон;ЗАЩИТНОЕ ЗЕРКАЛО 8 ХУМ - МОЩНАЯ ЗАЩИТА С ВОСЬМИ СТОРОН;Zashhitnoe-Zerkalo-8-Hum---moshhnaya-zashhita-s-vosmi-storon;_mpz33ddf10.jpg;none;none;none;80;60;153;M-2018-4;не указано;<null>;Металл;<null>;ЗЕРКАЛА ФЭН-ШУЙ;"<p>Зеркало с Защитой от 8 Хумов (негативных направлений) оберегает Вас от различных огорчений, которые приходят от 8 направлений в различные времена года.&nbsp;</p><p>Данное Зеркало идеально подойдет, если у вас сложный коллектив и есть сотрудники с негативной энергией.<br></p><p><b>? Поместите это Зеркало на Ваш рабочий стол для Защиты от злых начальников и коллег. Так же вы можете поместить данной Зеркало в центре Вашего Дома, чтобы защитить его от людей с плохими намерениями и иных опасностей!&nbsp;</b><br></p>";;Защитное Зеркало 8 Хум - мощная защита с восьми сторон;Защитное Зеркало 8 Хум - мощная защита с восьми сторон;2180;1980;2;10;57;0;t;f;f;f;<null>;<null>;<null>;<null>;2018-08-01 21:11:36.161078;2018-08-01 21:11:36.161078
17;6;0;0;Зеркало Божества Чунди с Защитными Мантрами от споров и судов;ЗЕРКАЛО БОЖЕСТВА ЧУНДИ С ЗАЩИТНЫМИ МАНТРАМИ ОТ СПОРОВ И СУДОВ;Zerkalo-Bozhestva-Chundi-s-Zashhitnymi-Mantrami-ot-sporov-i-sudov;Zerkalo_2.jpg;zerkalo-2.jpg;none;none;0;0;0;DJX-8095;не указано;не указано;не указано;Севастопольская;ЗЕРКАЛА ФЭН-ШУЙ;<p>Это Великолепное зеркало с изображением восьмирукой Богиней Чунди и защитными Мантрами - мощная Защита от споров, всех судебных вопросов, бед и неприятностей.</p><p>Мать Будд, Бодхисаттва Чунди является существом очень высокого духовного уровня. Она является мощной манифестацией Будды, исполняющей любые желания.<br></p><p><b>? Данное Зеркало можно размещать в любом месте Вашего дома, но место должно быть светлым, чистым и почитаемым - для проявления уважения к Богине Чунди.</b><br></p>;;Зеркало Божества Чунди - с Защитными Мантрами от споров и судов;Зеркало Божества Чунди - с Защитными Мантрами от споров и судов;1690;1490;2;0;56;0;f;f;t;t;<null>;<null>;<null>;<null>;2018-08-01 21:13:57.254811;2018-08-01 21:13:57.254811
19;4;1;0;Богиня Милосердия Гуан Инь с Гарудой;БОГИНЯ МИЛОСЕРДИЯ ГУАН ИНЬ С ГАРУДОЙ;Boginya-Miloserdiya-Guan-In-s-Garudoj;jeHoh4YYgLI.jpg;none;none;none;0;0;0;M-12;не указано;<null>;не указано;<null>;БОГИНИ ФЭН-ШУЙ;<p>Куан Инь, известная как Богиня Милосердия - это Будда Сострадания. Она защищает Вас от всех опасностей. Гаруда - мифическая птица, которая полностью подчиняет недуги и болезни.</p><p>В 2018 году звезда болезни № 2 улетает на Запад, затрагивая тех, кто родился в год Петуха. Особенно советуем всем тем, кто обладает слабой энергией здоровья!<br></p><p><b>? Поместите эту Богиню на Западе Вашего дома (лучше всего в спальнях) в 2018 году для защиты и исцеления от недугов!</b><br></p>;;Богиня Милосердия Гуан Инь с Гарудой;Богиня Милосердия Гуан Инь с Гарудой;2590;2360;2;0;65;0;f;f;f;t;<null>;<null>;<null>;<null>;2018-08-01 21:19:25.051688;2018-08-01 21:19:25.051688
20;12;0;0;Голубая Гора со Слоном и Носорогом - Мощная Защита от ограблений;ГОЛУБАЯ ГОРА СО СЛОНОМ И НОСОРОГОМ - МОЩНАЯ ЗАЩИТА ОТ ОГРАБЛЕНИЙ;Golubaya-Gora-so-Slonom-i-Nosorogom---Moshhnaya-Zashhita-ot-ograblenij;cErolp2nDFI.jpg;none;none;none;200;150;160;M-8909;не указано;<null>;не указано;<null>;СТАТУЭТКИ ФЭН-ШУЙ;"<p>Это мощное средство предназначено для защиты от негативной энергии, приносимой Звездой #7 Ограбления&nbsp; в 2018 году. Гора содержит мощные секретные мантры и изображение Голубого Носорога и Слона, чтобы защитить ваш дом от краж и ограблений!</p><p>В 2018 году ежегодная Звезда #7 грабежа летит на Восток, особенно сильно касаясь старших детей (сына) и тех, кто родился в год Кролика.&nbsp;<br></p><p><b>? Поместите эту Гору на востоке вашего дома!&nbsp;</b><br></p>";;Голубая Гора со Слоном и Носорогом - Мощная Защита от ограблений;Голубая Гора со Слоном и Носорогом - Мощная Защита от ограблений;2030;1890;2;0;43;0;f;f;f;f;<null>;<null>;<null>;<null>;2018-08-01 21:20:25.786807;2018-08-01 21:20:25.786807
21;6;0;0;"Тарелка декоративная ""Лотос"" подвесная";"ТАРЕЛКА ДЕКОРАТИВНАЯ ""ЛОТОС"" ПОДВЕСНАЯ";"Tarelka-dekorativnaya-""Lotos""-podvesnaya";тарелка-4.jpg;none;none;none;20;20;4;2381;не указано;<null>;Керамика;<null>;ПАННО;"Тарелка декоративная ""Лотос"" подвесная керамическая подвесная является мощной защитой в бизнесе";;"Тарелка декоративная ""Лотос"" подвесная";"Тарелка декоративная ""Лотос"" подвесная";418;320;10;20;24;10;t;f;f;t;<null>;<null>;<null>;<null>;2018-08-02 10:16:46.098755;2018-08-02 10:16:46.098755
